{
  "accepted_rows": 695,
  "anomalies": [
    {
      "evidence": {
        "declared_signature": "Kaiserslautern|Darmstadt|1ST_HALF|FOOTBALL_RESULT|RESULT:HOME",
        "matched_records": 5,
        "record_mappings": [
          {
            "APPLIED_RULE_ID": null,
            "CANONICAL_SETTLEMENT_EVENT": null,
            "CANONICAL_SIDE": "HOME",
            "CANONICAL_SIGNED_LINE": "",
            "HANDICAP_KIND": "",
            "MAPPING_RESULT": "REJECTED_UNPROVEN",
            "ORIGINAL_SEMANTIC_SIGNATURE": "FOOTBALL_RESULT|1ST_HALF|1X2|wynik meczu|Kaiserslautern|HOME||||WIN_LOSE|",
            "ORIGINAL_SIDE": "HOME",
            "ORIGINAL_SIGNED_LINE": "",
            "SETTLEMENT": "WIN_LOSE",
            "SOURCE_RECORD_ID": "ODD:76"
          },
          {
            "APPLIED_RULE_ID": null,
            "CANONICAL_SETTLEMENT_EVENT": null,
            "CANONICAL_SIDE": "DRAW",
            "CANONICAL_SIGNED_LINE": "",
            "HANDICAP_KIND": "",
            "MAPPING_RESULT": "REJECTED_UNPROVEN",
            "ORIGINAL_SEMANTIC_SIGNATURE": "FOOTBALL_RESULT|2ND_HALF|1X2|wynik meczu||DRAW||||WIN_LOSE|",
            "ORIGINAL_SIDE": "DRAW",
            "ORIGINAL_SIGNED_LINE": "",
            "SETTLEMENT": "WIN_LOSE",
            "SOURCE_RECORD_ID": "ODD:79"
          },
          {
            "APPLIED_RULE_ID": null,
            "CANONICAL_SETTLEMENT_EVENT": null,
            "CANONICAL_SIDE": "HOME_AXIS",
            "CANONICAL_SIGNED_LINE": "-0.5",
            "HANDICAP_KIND": "TWO_WAY",
            "MAPPING_RESULT": "REJECTED_UNPROVEN",
            "ORIGINAL_SEMANTIC_SIGNATURE": "FOOTBALL_RESULT|1ST_HALF|HANDICAP_EUROPEAN|handicap (2-drożny) - 1. połowa||HOME|-0.5|TWO_WAY|TWO_WAY_NO_DRAW|NO_PUSH|",
            "ORIGINAL_SIDE": "HOME",
            "ORIGINAL_SIGNED_LINE": "-0.5",
            "SETTLEMENT": "NO_PUSH",
            "SOURCE_RECORD_ID": "ODD:157"
          },
          {
            "APPLIED_RULE_ID": null,
            "CANONICAL_SETTLEMENT_EVENT": null,
            "CANONICAL_SIDE": "HOME",
            "CANONICAL_SIGNED_LINE": "",
            "HANDICAP_KIND": "",
            "MAPPING_RESULT": "REJECTED_UNPROVEN",
            "ORIGINAL_SEMANTIC_SIGNATURE": "FOOTBALL_RESULT|1ST_HALF|1X2|wynik meczu|Kaiserslautern|HOME||||WIN_LOSE|",
            "ORIGINAL_SIDE": "HOME",
            "ORIGINAL_SIGNED_LINE": "",
            "SETTLEMENT": "WIN_LOSE",
            "SOURCE_RECORD_ID": "ODD:180"
          },
          {
            "APPLIED_RULE_ID": null,
            "CANONICAL_SETTLEMENT_EVENT": null,
            "CANONICAL_SIDE": "DRAW",
            "CANONICAL_SIGNED_LINE": "",
            "HANDICAP_KIND": "",
            "MAPPING_RESULT": "REJECTED_UNPROVEN",
            "ORIGINAL_SEMANTIC_SIGNATURE": "FOOTBALL_RESULT|2ND_HALF|1X2|wynik meczu||DRAW||||WIN_LOSE|",
            "ORIGINAL_SIDE": "DRAW",
            "ORIGINAL_SIGNED_LINE": "",
            "SETTLEMENT": "WIN_LOSE",
            "SOURCE_RECORD_ID": "ODD:183"
          }
        ],
        "result": "REJECTED_UNPROVEN_OR_MIXED_SEMANTICS",
        "semantic_signatures": [
          "FOOTBALL_RESULT|1ST_HALF|1X2|wynik meczu|Kaiserslautern|HOME||||WIN_LOSE|",
          "FOOTBALL_RESULT|1ST_HALF|HANDICAP_EUROPEAN|handicap (2-drożny) - 1. połowa||HOME|-0.5|TWO_WAY|TWO_WAY_NO_DRAW|NO_PUSH|",
          "FOOTBALL_RESULT|2ND_HALF|1X2|wynik meczu||DRAW||||WIN_LOSE|"
        ],
        "source_index": 2
      },
      "severity": "HIGH",
      "type": "EQUIVALENCE_GROUP_REJECTED"
    },
    {
      "evidence": {
        "declared_signature": "Kaiserslautern|Darmstadt|2ND_HALF|FOOTBALL_RESULT|RESULT:DRAW",
        "matched_records": 4,
        "record_mappings": [
          {
            "APPLIED_RULE_ID": null,
            "CANONICAL_SETTLEMENT_EVENT": null,
            "CANONICAL_SIDE": "HOME",
            "CANONICAL_SIGNED_LINE": "",
            "HANDICAP_KIND": "",
            "MAPPING_RESULT": "REJECTED_UNPROVEN",
            "ORIGINAL_SEMANTIC_SIGNATURE": "FOOTBALL_RESULT|1ST_HALF|1X2|wynik meczu|Kaiserslautern|HOME||||WIN_LOSE|",
            "ORIGINAL_SIDE": "HOME",
            "ORIGINAL_SIGNED_LINE": "",
            "SETTLEMENT": "WIN_LOSE",
            "SOURCE_RECORD_ID": "ODD:76"
          },
          {
            "APPLIED_RULE_ID": null,
            "CANONICAL_SETTLEMENT_EVENT": null,
            "CANONICAL_SIDE": "DRAW",
            "CANONICAL_SIGNED_LINE": "",
            "HANDICAP_KIND": "",
            "MAPPING_RESULT": "REJECTED_UNPROVEN",
            "ORIGINAL_SEMANTIC_SIGNATURE": "FOOTBALL_RESULT|2ND_HALF|1X2|wynik meczu||DRAW||||WIN_LOSE|",
            "ORIGINAL_SIDE": "DRAW",
            "ORIGINAL_SIGNED_LINE": "",
            "SETTLEMENT": "WIN_LOSE",
            "SOURCE_RECORD_ID": "ODD:79"
          },
          {
            "APPLIED_RULE_ID": null,
            "CANONICAL_SETTLEMENT_EVENT": null,
            "CANONICAL_SIDE": "HOME",
            "CANONICAL_SIGNED_LINE": "",
            "HANDICAP_KIND": "",
            "MAPPING_RESULT": "REJECTED_UNPROVEN",
            "ORIGINAL_SEMANTIC_SIGNATURE": "FOOTBALL_RESULT|1ST_HALF|1X2|wynik meczu|Kaiserslautern|HOME||||WIN_LOSE|",
            "ORIGINAL_SIDE": "HOME",
            "ORIGINAL_SIGNED_LINE": "",
            "SETTLEMENT": "WIN_LOSE",
            "SOURCE_RECORD_ID": "ODD:180"
          },
          {
            "APPLIED_RULE_ID": null,
            "CANONICAL_SETTLEMENT_EVENT": null,
            "CANONICAL_SIDE": "DRAW",
            "CANONICAL_SIGNED_LINE": "",
            "HANDICAP_KIND": "",
            "MAPPING_RESULT": "REJECTED_UNPROVEN",
            "ORIGINAL_SEMANTIC_SIGNATURE": "FOOTBALL_RESULT|2ND_HALF|1X2|wynik meczu||DRAW||||WIN_LOSE|",
            "ORIGINAL_SIDE": "DRAW",
            "ORIGINAL_SIGNED_LINE": "",
            "SETTLEMENT": "WIN_LOSE",
            "SOURCE_RECORD_ID": "ODD:183"
          }
        ],
        "result": "REJECTED_UNPROVEN_OR_MIXED_SEMANTICS",
        "semantic_signatures": [
          "FOOTBALL_RESULT|1ST_HALF|1X2|wynik meczu|Kaiserslautern|HOME||||WIN_LOSE|",
          "FOOTBALL_RESULT|2ND_HALF|1X2|wynik meczu||DRAW||||WIN_LOSE|"
        ],
        "source_index": 4
      },
      "severity": "HIGH",
      "type": "EQUIVALENCE_GROUP_REJECTED"
    },
    {
      "evidence": {
        "declared_signature": "Kaiserslautern|Darmstadt|FULL_TIME|FOOTBALL_GOALS|NOT_BTTS_AND_UNDER:2.5",
        "matched_records": 3,
        "record_mappings": [
          {
            "APPLIED_RULE_ID": null,
            "CANONICAL_SETTLEMENT_EVENT": null,
            "CANONICAL_SIDE": "BTTS_OR_OVER_NO",
            "CANONICAL_SIGNED_LINE": "2.5",
            "HANDICAP_KIND": "",
            "MAPPING_RESULT": "REJECTED_UNPROVEN",
            "ORIGINAL_SEMANTIC_SIGNATURE": "OTHER:COMPOUND_LOGIC|FULL_TIME|COMPOUND_LOGIC|oba zespoły strzelą gola lub powyżej 2,5 gola w meczu||BTTS_OR_OVER_NO|2.5|||WIN_LOSE|",
            "ORIGINAL_SIDE": "",
            "ORIGINAL_SIGNED_LINE": "2.5",
            "SETTLEMENT": "WIN_LOSE",
            "SOURCE_RECORD_ID": "ODD:36"
          },
          {
            "APPLIED_RULE_ID": null,
            "CANONICAL_SETTLEMENT_EVENT": null,
            "CANONICAL_SIDE": "BTTS_OR_OVER_NO",
            "CANONICAL_SIGNED_LINE": "2.5",
            "HANDICAP_KIND": "",
            "MAPPING_RESULT": "REJECTED_UNPROVEN",
            "ORIGINAL_SEMANTIC_SIGNATURE": "OTHER:COMPOUND_LOGIC|FULL_TIME|COMPOUND_LOGIC|oba zespoły strzelą gola lub powyżej 2,5 gola w meczu||BTTS_OR_OVER_NO|2.5|||WIN_LOSE|",
            "ORIGINAL_SIDE": "",
            "ORIGINAL_SIGNED_LINE": "2.5",
            "SETTLEMENT": "WIN_LOSE",
            "SOURCE_RECORD_ID": "ODD:397"
          },
          {
            "APPLIED_RULE_ID": null,
            "CANONICAL_SETTLEMENT_EVENT": null,
            "CANONICAL_SIDE": "BTTS_NO_AND_UNDER",
            "CANONICAL_SIGNED_LINE": "2.5",
            "HANDICAP_KIND": "",
            "MAPPING_RESULT": "REJECTED_UNPROVEN",
            "ORIGINAL_SEMANTIC_SIGNATURE": "OTHER:COMPOUND_LOGIC|FULL_TIME|COMPOUND_LOGIC|oba zespoły strzelą gola / liczba bramek||BTTS_NO_AND_UNDER|2.5|||WIN_LOSE|",
            "ORIGINAL_SIDE": "",
            "ORIGINAL_SIGNED_LINE": "2.5",
            "SETTLEMENT": "WIN_LOSE",
            "SOURCE_RECORD_ID": "ODD:449"
          }
        ],
        "result": "REJECTED_UNPROVEN_OR_MIXED_SEMANTICS",
        "semantic_signatures": [
          "OTHER:COMPOUND_LOGIC|FULL_TIME|COMPOUND_LOGIC|oba zespoły strzelą gola / liczba bramek||BTTS_NO_AND_UNDER|2.5|||WIN_LOSE|",
          "OTHER:COMPOUND_LOGIC|FULL_TIME|COMPOUND_LOGIC|oba zespoły strzelą gola lub powyżej 2,5 gola w meczu||BTTS_OR_OVER_NO|2.5|||WIN_LOSE|"
        ],
        "source_index": 6
      },
      "severity": "HIGH",
      "type": "EQUIVALENCE_GROUP_REJECTED"
    },
    {
      "evidence": {
        "allowlist_rule": "1X2_AWAY_EQ_HANDICAP_AWAY_MINUS_0_5_TWO_WAY_SAME_PERIOD",
        "best": {
          "category": "Top",
          "market": "Wynik meczu (z wyłączeniem dogrywki)",
          "odds": 3.2
        },
        "canonical_settlement_event": "FOOTBALL_RESULT|FULL_TIME|RESULT_AWAY",
        "safety": "PASS_EXACT_MATHEMATICAL_EQUIVALENCE",
        "signature": "FOOTBALL_RESULT|FULL_TIME|RESULT_AWAY",
        "worse_copies": [
          {
            "category": "Wynik",
            "gain_percent": 7.38255,
            "market": "Handicap (2-drożny)",
            "odds": 2.98
          }
        ]
      },
      "severity": "MEDIUM",
      "type": "IDENTICAL_SETTLEMENT_BETTER_PRICE"
    },
    {
      "evidence": {
        "allowlist_rule": "1X2_HOME_EQ_HANDICAP_HOME_MINUS_0_5_TWO_WAY_SAME_PERIOD",
        "best": {
          "category": "Wynik",
          "market": "Handicap (2-drożny)",
          "odds": 2.1
        },
        "canonical_settlement_event": "FOOTBALL_RESULT|FULL_TIME|RESULT_HOME",
        "safety": "PASS_EXACT_MATHEMATICAL_EQUIVALENCE",
        "signature": "FOOTBALL_RESULT|FULL_TIME|RESULT_HOME",